{
  "kind": "localization",
  "$comment": "Every content message key, in the default locale.",
  "locale": "en",
  "messages": {
    "content.ammo.hybrid.small.iron.description": "Kinetic damage and the longest reach a small railgun has.",
    "content.ammo.hybrid.small.iron.name": "Iron Charge S",
    "content.ammo.hybrid.small.plasma.description": "Thermal damage up close, trading away range.",
    "content.ammo.hybrid.small.plasma.name": "Plasma Charge S",
    "content.ammo.projectile.small.fusion.description": "Heavy explosive damage at close range.",
    "content.ammo.projectile.small.fusion.name": "Fusion S",
    "content.ammo.projectile.small.phased.description": "Thermal damage and more reach, at the cost of raw punch.",
    "content.ammo.projectile.small.phased.name": "Phased Plasma S",
    "content.encounter.borrell.pirate-base.description": "Two gunners and a warden around a cradle of scrap, with a marksman watching from range. The gunners outrun an unboosted light hull and hit hard up close; the warden carries two guns of its own and repairs its armour while its capacitor lasts. Their phased rounds still bite at 10 km, so a ship that controls the range - or outranges them - chooses the fight. A starter fit will not survive this one.",
    "content.encounter.borrell.pirate-base.name": "Pirate Base",
    "content.encounter.borrell.pirate-base.reward": "The largest bounties in Borrell, and the best salvage: circuitry, armour plating, capacitor batteries and sometimes a railgun.",
    "content.encounter.borrell.pirate-patrol.description": "Two cutters and a marksman holding a lane. The cutters close fast with two guns each, and their shields shrug off explosive rounds. The marksman sits far off and will not come to you. Decide what you kill first.",
    "content.encounter.borrell.pirate-patrol.name": "Pirate Patrol",
    "content.encounter.borrell.pirate-patrol.reward": "A bounty for each of the three pirates. Their wrecks carry salvage and ammunition, and now and then an afterburner or armour plating.",
    "content.encounter.borrell.pirate-scout.description": "A lone pirate watching the belt. One opponent, close range, nothing the ship you were given cannot handle.",
    "content.encounter.borrell.pirate-scout.name": "Pirate Scout",
    "content.encounter.borrell.pirate-scout.reward": "A bounty for the pirate, and whatever survives in its wreck: salvage to sell and sometimes a few fusion rounds.",
    "content.guide.loop.carry-rounds.body": "Your autocannon's magazine holds 20 rounds, and a fight takes more. A gun reloads only from the ship's hold, never from the station, and the spare rounds you started with are running down. Keep at least two magazines' worth in the hold: buy Fusion S at the Market ({keyStationMarket}), or open the Hangar ({keyStationHangar}) and use Move to hold on rounds stored there.",
    "content.guide.loop.carry-rounds.title": "Carry spare rounds",
    "content.guide.loop.choose-site.body": "Open Departure ({keyStationDeparture}). Every site shows its tier, its opponents and what it pays. Choose the Pirate Scout: one opponent, and the ship you were given can beat it.",
    "content.guide.loop.choose-site.title": "Choose a site",
    "content.guide.loop.clear.body": "Destroy every opponent. The Encounter panel tracks what is left and the bounty paid for each kill, straight into your wallet.",
    "content.guide.loop.clear.title": "Clear the site",
    "content.guide.loop.completed": "You have flown the whole loop. The sites stay open - replay them for credits, or try the Pirate Base when your fit is ready for it.",
    "content.guide.loop.defend.body": "Toggle the booster with {keyModuleToggle1} when your shield starts to drop. Each cycle costs capacitor - watch it in Your ship. An empty capacitor stops the booster, so switch it off once the shield is safe.",
    "content.guide.loop.defend.title": "Run your shield booster",
    "content.guide.loop.fire.body": "Fire ({keyWeaponsFire}) sends every weapon that can shoot at the locked target. The Weapons panel shows your hit chance and whether range or tracking is holding it down.",
    "content.guide.loop.fire.title": "Open fire",
    "content.guide.loop.harder.body": "The Pirate Patrol sends two fast cutters and a marksman: kill the cutters first, then chase the marksman. At the Pirate Base, keep range and always fight the nearest brawler. Tier is advice, not a gate.",
    "content.guide.loop.harder.title": "Try a harder site",
    "content.guide.loop.intro": "A few steps take you through the whole loop: pick a fight, win it, bring the spoils home and turn them into a better ship. Do them in any order; skip any you already know.",
    "content.guide.loop.lock.body": "With the pirate selected, Lock target ({keyTargetingLock}) once it is inside your lock range - until then the button says why it cannot. Locking takes a few seconds; the Locks panel counts it down and shows the formula behind it.",
    "content.guide.loop.lock.title": "Lock a target",
    "content.guide.loop.loot.body": "Select a wreck and Approach it at 0.5 km. Once in reach, Take all ({keyLootTakeAll}) moves what fits into your hold. Wrecks do not last forever.",
    "content.guide.loop.loot.title": "Loot the wreck",
    "content.guide.loop.move.body": "Select a pirate in the view or the list ({keySpaceSelectNext} steps through them), then Orbit ({keyMovementOrbit}), Approach ({keyMovementApproach}) or Keep range ({keyMovementKeepRange}) at the distance in the range box. You command the ship; it flies itself.",
    "content.guide.loop.move.title": "Give a movement order",
    "content.guide.loop.ready.body": "In Services ({keyStationServices}), repair and resupply. Repairing the shield is free and recharges the capacitor with it - do it even when nothing is broken, because a ship that undocks on an empty capacitor cannot run its booster.",
    "content.guide.loop.ready.title": "Get the ship ready",
    "content.guide.loop.return.body": "Retreat ({keyNavigationRetreat}) warps you home; then Dock ({keyNavigationDock}). Retreat works mid-fight too: leaving a site is always allowed, and the pirates do not follow.",
    "content.guide.loop.return.title": "Return and dock",
    "content.guide.loop.sell.body": "Open the Market ({keyStationMarket}) and sell salvage you cannot use. Keep modules and ammunition your next fit wants - the hold's contents are listed there too.",
    "content.guide.loop.sell.title": "Sell your loot",
    "content.guide.loop.title": "Flight school",
    "content.guide.loop.undock.body": "Open Departure ({keyStationDeparture}) and press Undock. The station warns you first about anything a fight would punish, such as a gun with no ammunition or no spare rounds in the hold, and shows how charged your capacitor is.",
    "content.guide.loop.undock.title": "Undock",
    "content.guide.loop.upgrade.body": "Buy an upgrade at the Market - a second autocannon is the first big step - then open Fitting ({keyStationFitting}), Change fit, put it in a slot and Apply fit. The Ship view shows what changed and why.",
    "content.guide.loop.upgrade.title": "Improve the fit",
    "content.guide.loop.warp.body": "In space, set Arrive at to 10 km, then Warp ({keyNavigationWarp}) to the site you chose. Nothing moves while the clock is paused, so Resume ({keyTimeToggle}) if it is. From farther out the flight in takes minutes; at 10 km the pirate comes to you.",
    "content.guide.loop.warp.title": "Warp to the site",
    "content.hull.independent.starter.description": "An independent light hull sold at every neutral station. It does nothing outstandingly well and nothing badly, which is what makes it the ship a pilot starts and restarts in.",
    "content.hull.independent.starter.name": "Wayfarer",
    "content.hull.independent.starter.trait.versatile": "Fits any small weapon and enough support to survive a mistake.",
    "content.hull.pirate.raider.description": "A heavier pirate hull carrying armour and a second gun, and quicker than it looks.",
    "content.hull.pirate.raider.name": "Corsair",
    "content.hull.pirate.raider.trait.armoured": "Armoured, faster than an unboosted light hull and willing to trade hits.",
    "content.hull.pirate.scout.description": "A stripped-down pirate hull that trades armour for speed.",
    "content.hull.pirate.scout.name": "Cutlass",
    "content.hull.pirate.scout.trait.fast": "Fast, fragile and hard to hit at range.",
    "content.item.commodity.coolant.description": "Station-grade coolant. Always bought, never scarce for long.",
    "content.item.commodity.coolant.name": "Reactor Coolant",
    "content.item.salvage.alloy.description": "Scorched hull plating. Worth something to a station foundry.",
    "content.item.salvage.alloy.name": "Burned Alloy Plate",
    "content.item.salvage.circuitry.description": "Targeting electronics, mostly intact. Stations buy these.",
    "content.item.salvage.circuitry.name": "Charred Circuitry",
    "content.module.capacitor.battery.small.description": "Adds capacitor capacity, which lengthens how long active modules can keep running.",
    "content.module.capacitor.battery.small.name": "Small Capacitor Battery",
    "content.module.plating.armor.small.description": "Passive resistance across every damage type. It needs no capacitor and never stops working.",
    "content.module.plating.armor.small.name": "Small Armour Plating",
    "content.module.propulsion.afterburner.small.description": "Raises maximum speed while it cycles, which changes both how quickly you close and how well guns track you.",
    "content.module.propulsion.afterburner.small.name": "1MN Afterburner",
    "content.module.repair.armor.small.description": "Restores armour at the end of each cycle. Strong recovery for a heavy capacitor cost.",
    "content.module.repair.armor.small.name": "Small Armour Repairer",